{
  "$schema": "https://json-schema.org/draft/2020-12/schema",
  "$id": "https://provability-fabric.local/schemas/trace-replay-cert.schema.json",
  "title": "TRACE-REPLAY-KIT certificate",
  "description": "Local fixture schema for KIT-emitted trace_replay certificates. The private CERT-V1 raw URL (cert-v1.json) is not fetchable in CI; sidecar cert-v1.schema.json describes a different shape.",
  "type": "object",
  "required": [
    "cert_type",
    "version",
    "timestamp",
    "replay_id",
    "environment",
    "results",
    "summary",
    "signature"
  ],
  "properties": {
    "$schema": { "type": "string" },
    "cert_type": { "const": "trace_replay" },
    "version": { "type": "string" },
    "timestamp": { "type": "string" },
    "replay_id": { "type": "string" },
    "trace_metadata": { "type": "object" },
    "environment": {
      "type": "object",
      "required": ["locale", "timezone", "seed", "versions"],
      "properties": {
        "locale": { "type": "string" },
        "timezone": { "type": "string" },
        "seed": {},
        "versions": { "type": "object" }
      },
      "additionalProperties": true
    },
    "results": {
      "type": "array",
      "items": { "type": "object" }
    },
    "summary": {
      "type": "object",
      "required": ["total_events", "successful_events", "failed_events"],
      "properties": {
        "total_events": { "type": "integer" },
        "successful_events": { "type": "integer" },
        "failed_events": { "type": "integer" }
      },
      "additionalProperties": true
    },
    "signature": {
      "type": "object",
      "required": ["algorithm", "hash"],
      "properties": {
        "algorithm": { "type": "string" },
        "hash": { "type": "string" }
      },
      "additionalProperties": true
    }
  },
  "additionalProperties": true
}
